<domain xmlns="http://www.xquerrail-framework.com/domain"
    xmlns:security="http://www.xquery/security"
    xmlns:xsi="http://www.w3.org/2001/XMLSchema-instance"
    xsi:schemaLocation="http://www.xquerrail-framework.com/domain file:../../_framework/schema/domain.xsd">
    <name>application</name>
    <content-namespace prefix="cndam" namespace-uri="http://www.condenast.com/dam/2.0"/>
    <application-namespace>http://www.condenast.com/dam/2.0</application-namespace>
    <description>Conde Nast DAM 2.0</description>
    <author>Andrew Wanczowski, Gary Vidal</author>
    <version>1.0</version>

    <declare-namespace prefix="dcterms" namespace-uri="http://purl.org/dc/terms/"/>
    <declare-namespace prefix="cnp" namespace-uri="reserved path"/>
    
    <!--
    <roles>
        <role name="cndam-admin" type="admin"/>
        <role name="cndam-editor" type="editor"/>
        <role name="cndam-user" type="user"/>
        <role name="cndam-nobody" type="anonymous"/>
        <role name="cndam-create" type="create"/>
        <role name="cndam-read" type="read"/>
        <role name="cndam-write" type="write"/>
        <role name="cndam-delete" type="delete"/>
        <role name="cndam-execute" type="execute"/>
    </roles>
    -->
    
    <!-- Georgraphic Related Models -->
    <model name="countryCode" description="Country Code Controlled Vocabulary" persistence="document">
        <document>/vocabularies/countryCodes.xml</document>
        <declare-namespace prefix="cndam" namespace-uri="http://www.condenast.com/dam/2.0"/>
        <element name="id" type="string" identity="true" label="ISO Country Code">
            <navigation searchable="true" sortable="true" facetable="true"/>
            <constraint required="true"/>
        </element>
        <element name="name" type="string" label="Name">
            <navigation searchable="true" sortable="true" />
            <constraint  required="true"/>
        </element>
        <element name="iso3" type="integer" label="ISO 3 digit">
            <navigation searchable="true" sortable="true" />
            <constraint  required="true"/>
        </element>
    </model>
    <model name="timezone" description="Timezones Configuration" persistence="document">
        <document>/vocabularies/timezones.xml</document>
        <declare-namespace prefix="cndam" namespace-uri="http://www.condenast.com/dam/2.0"/>
        <element name="id" type="string" identity="true" label="ID">
            <navigation searchable="true" sortable="true" facetable="true" />
            <constraint required="true"/>
        </element>
        <element name="offset" type="decimal" label="GMT Offset">
            <navigation searchable="true" sortable="true" facetable="true"/>
            <constraint required="true"/>
        </element>
        <element name="name" type="string" label="Name">
            <navigation searchable="true" sortable="true"/>
            <constraint  required="true"/>
        </element>
    </model>
    <model name="locale" description="Locales" persistence="document">
        <document>/vocabularies/locales.xml</document>
        <declare-namespace prefix="cndam" namespace-uri="http://www.condenast.com/dam/2.0"/>
        <element name="id" type="string" identity="true" >
            <navigation searchable="true" sortable="true" facetable="true"/>
            <constraint required="true"/>
        </element>
        <element name="name" type="string">
            <navigation searchable="true" sortable="true"/>
            <constraint  required="true"/>
        </element>
    </model>

    <!-- Publication Related Models -->
    <model name="publicationGroup" description="Publication Group" persistence="document">
        <document>/authorities/publicationGroups.xml</document>
        <declare-namespace prefix="cndam" namespace-uri="http://www.condenast.com/dam/2.0"/>
        <element name="id" type="string" identity="true" >
            <navigation searchable="true" sortable="true" facetable="true"/>
            <constraint required="true"/>
        </element>
        <element name="name" type="string">
            <navigation searchable="true" sortable="true"/>
            <constraint  required="true"/>
        </element>
    </model>
    <model name="publication" description="Publication Group" persistence="document">
        <document>/vocabularies/publications.xml</document>
        <declare-namespace prefix="cndam" namespace-uri="http://www.condenast.com/dam/2.0"/> 
        <import-model name="issnCode"/>
        <element name="publicationId" type="string" identity="true" label="ID">
            <navigation searchable="true" sortable="true" facetable="true"/>
            <constraint required="true"/>
        </element>
        <element name="publicationName" type="string" label="Publication Name">
            <navigation searchable="true" sortable="true"/>
            <constraint required="true"/>
        </element>
        <element name="issnNumber" type="string" label="ISSN Number">
            <navigation searchable="true" sortable="true"/>
            <constraint required="true"/>
        </element>
        <hasMany name="issnCodes" type="issnCode" reference="model:issnCode:reference"/>        
    </model>
    <model name="issnCode" description="ISSN Codes" persistence="document">
        <document>/vocabularies/issnCodes.xml</document>
        <declare-namespace prefix="cndam" namespace-uri="http://www.condenast.com/dam/2.0"/>
        <element name="id" type="string" identity="true">
            <navigation searchable="true" sortable="true" facetable="true"/>
            <constraint required="true"/>
        </element>
        <element name="name" type="string">
            <navigation searchable="true" sortable="true"/>
            <constraint required="true"/>
        </element>
    </model>
    
    <!-- Ingestion Related Models -->
    <model name="packageType" description="Package Type" persistence="document">
        <document>/packageTypes/packageTypes.xml</document>
        <declare-namespace prefix="cndam" namespace-uri="http://www.condenast.com/dam/2.0"/>
        <import-model name="assetType"/>
        <element name="id" type="string" identity="true" >
            <navigation searchable="true" sortable="true" facetable="true"/>
            <constraint required="true"/>
        </element>
        <element name="name" type="string">
            <navigation searchable="true" sortable="true"/>
            <constraint  required="true"/>
        </element>
       	<hasMany name="assetTypes" type="assetType" reference="model:assetType:reference"/>
    </model>    
    <model name="assetType" description="AssetType" persistence="document">
        <document>/assetTypes/assetTypes.xml</document>
        <declare-namespace prefix="cndam" namespace-uri="http://www.condenast.com/dam/2.0"/>
        <element name="id" type="string" identity="true" label="ID" >
            <navigation searchable="true" sortable="true" facetable="true"/>
            <constraint required="true"/>
        </element>
        <element name="description" type="string" label="Asset Description">
            <navigation searchable="true" sortable="true"/>
            <constraint  required="true"/>
        </element>
        <element name="namespace-uri" type="string" label="Namespace">
            <navigation searchable="true" sortable="true"/>
            <constraint  required="true"/>
        </element>
        <element name="element" type="string" label="Root Name">
            <navigation searchable="true" sortable="true"/>
            <constraint  required="true"/>
        </element>
        <element name="xmlSchemaLocation" type="string" label="Schema Location">
            <navigation searchable="true" sortable="true"/>
            <constraint  required="true"/>
        </element>
        <element name="isActive" type="boolean" label="Active">
            <navigation searchable="true" sortable="true"/>
            <constraint  required="true"/>
        </element>
    </model>  

    <!-- Start Validation Models -->
    <model name="schema" description="Schemas for validating ingested content" persistence="document">
        <document>/config/validation/schemas.xml</document>
        <declare-namespace prefix="cndam" namespace-uri="http://www.condenast.com/dam/2.0"/>
        <element name="id" type="string" identity="true" label="Schema ID">
            <navigation searchable="true" sortable="true" facetable="true"/>
            <constraint required="true"/>
        </element>
        <element name="name" type="string" label="Name">
            <navigation searchable="true" sortable="true" />
            <constraint  required="true"/>
        </element>
        <element name="schemaLocation" type="string" label="Schema Location">
            <navigation searchable="true" sortable="true" />
            <constraint  required="true"/>
        </element>
        <element name="namespace" type="string" label="Schema namespace">
            <navigation searchable="true" sortable="true" />
            <constraint  required="true"/>
        </element>
        <element name="isPrimary" type="boolean" label="Is Primary Schema">
            <navigation searchable="true" sortable="true" />
            <constraint  required="true"/>
        </element>
    </model>
    <model name="schematron" description="Schematron for validating ingested content" persistence="directory">
        <directory>/schematrons/</directory>
        <declare-namespace prefix="cndam" namespace-uri="http://www.condenast.com/dam/2.0"/>
        <element name="id" type="string" identity="true" label="Schematron ID">
            <navigation searchable="true" sortable="true" facetable="true"/>
            <constraint required="true"/>
        </element>
        <element name="name" type="string" label="Name">
            <navigation searchable="true" sortable="true" />
            <constraint required="true"/>